{
  "$schema": "./seed-session.schema.json",
  "name": "seed-session",
  "description": "The canonical transcript-fx reference session (SPEC §5). A recorded timeline of source events both runtimes replay to prove web ≡ Swift. 5 self-corrections (cue→Q3, to→two, their→there, tree→three, ate→eight) and 2 redactions (Acme, Sarah).",
  "config": {
    "confidenceThreshold": 0.6
  },
  "events": [
    { "op": "append", "id": "1", "text": "okay", "confidence": 0.92, "gap": 175 },
    { "op": "append", "id": "2", "text": "so", "confidence": 0.92, "gap": 175 },
    { "op": "append", "id": "3", "text": "the", "confidence": 0.92, "gap": 175 },
    { "op": "append", "id": "4", "text": "cue", "confidence": 0.4, "gap": 175 },
    { "op": "append", "id": "5", "text": "deck", "confidence": 0.92, "gap": 175 },
    { "op": "append", "id": "6", "text": "is", "confidence": 0.92, "gap": 175 },
    { "op": "revise", "id": "4", "text": "Q3", "gap": 620 },
    { "op": "append", "id": "7", "text": "nearly", "confidence": 0.92, "gap": 175 },
    { "op": "append", "id": "8", "text": "ready", "confidence": 0.92, "gap": 175 },
    { "op": "append", "id": "9", "text": "let's", "confidence": 0.92, "gap": 175 },
    { "op": "append", "id": "10", "text": "loop", "confidence": 0.92, "gap": 175 },
    { "op": "append", "id": "11", "text": "in", "confidence": 0.92, "gap": 175 },
    { "op": "append", "id": "12", "text": "Acme", "confidence": 0.5, "gap": 320 },
    { "op": "append", "id": "13", "text": "about", "confidence": 0.92, "gap": 175 },
    { "op": "append", "id": "14", "text": "the", "confidence": 0.92, "gap": 175 },
    { "op": "append", "id": "15", "text": "to", "confidence": 0.4, "gap": 175 },
    { "op": "append", "id": "16", "text": "deadlines", "confidence": 0.92, "gap": 175 },
    { "op": "revise", "id": "15", "text": "two", "gap": 560 },
    { "op": "append", "id": "17", "text": "their", "confidence": 0.45, "gap": 175 },
    { "op": "append", "id": "18", "text": "are", "confidence": 0.92, "gap": 175 },
    { "op": "append", "id": "19", "text": "tree", "confidence": 0.4, "gap": 175 },
    { "op": "append", "id": "20", "text": "open", "confidence": 0.92, "gap": 175 },
    { "op": "append", "id": "21", "text": "items", "confidence": 0.92, "gap": 175 },
    { "op": "revise", "id": "17", "text": "there", "gap": 460 },
    { "op": "revise", "id": "19", "text": "three", "gap": 640 },
    { "op": "append", "id": "22", "text": "we", "confidence": 0.92, "gap": 175 },
    { "op": "append", "id": "23", "text": "still", "confidence": 0.92, "gap": 175 },
    { "op": "append", "id": "24", "text": "need", "confidence": 0.92, "gap": 175 },
    { "op": "append", "id": "25", "text": "to", "confidence": 0.92, "gap": 175 },
    { "op": "append", "id": "26", "text": "close", "confidence": 0.92, "gap": 175 },
    { "op": "append", "id": "27", "text": "before", "confidence": 0.92, "gap": 175 },
    { "op": "append", "id": "28", "text": "Friday", "confidence": 0.8, "gap": 300 },
    { "op": "append", "id": "29", "text": "can", "confidence": 0.92, "gap": 175 },
    { "op": "append", "id": "30", "text": "you", "confidence": 0.92, "gap": 175 },
    { "op": "append", "id": "31", "text": "send", "confidence": 0.92, "gap": 175 },
    { "op": "append", "id": "32", "text": "the", "confidence": 0.92, "gap": 175 },
    { "op": "append", "id": "33", "text": "revenue", "confidence": 0.7, "gap": 175 },
    { "op": "append", "id": "34", "text": "figures", "confidence": 0.7, "gap": 175 },
    { "op": "append", "id": "35", "text": "to", "confidence": 0.92, "gap": 175 },
    { "op": "append", "id": "36", "text": "Sarah", "confidence": 0.5, "gap": 320 },
    { "op": "append", "id": "37", "text": "and", "confidence": 0.92, "gap": 175 },
    { "op": "append", "id": "38", "text": "update", "confidence": 0.92, "gap": 175 },
    { "op": "append", "id": "39", "text": "the", "confidence": 0.92, "gap": 175 },
    { "op": "append", "id": "40", "text": "margin", "confidence": 0.92, "gap": 175 },
    { "op": "append", "id": "41", "text": "slide", "confidence": 0.92, "gap": 175 },
    { "op": "append", "id": "42", "text": "we", "confidence": 0.92, "gap": 175 },
    { "op": "append", "id": "43", "text": "were", "confidence": 0.92, "gap": 175 },
    { "op": "append", "id": "44", "text": "off", "confidence": 0.92, "gap": 175 },
    { "op": "append", "id": "45", "text": "by", "confidence": 0.92, "gap": 175 },
    { "op": "append", "id": "46", "text": "about", "confidence": 0.92, "gap": 175 },
    { "op": "append", "id": "47", "text": "ate", "confidence": 0.4, "gap": 175 },
    { "op": "append", "id": "48", "text": "percent", "confidence": 0.92, "gap": 175 },
    { "op": "revise", "id": "47", "text": "eight", "gap": 560 },
    { "op": "append", "id": "49", "text": "last", "confidence": 0.92, "gap": 175 },
    { "op": "append", "id": "50", "text": "quarter", "confidence": 0.85, "gap": 800 },
    { "op": "redact", "id": "12", "gap": 850 },
    { "op": "redact", "id": "36", "gap": 1100 },
    { "op": "finalize", "gap": 3600 }
  ]
}
